
<libro id="L0001" tipo_clase="didáctico" paginas="250" xmlns:xsi="http://www.w3.org/2001/XMLSchema-instance"
    xsi:noNamespaceSchemaLocation= "XSD/XSD_libros.xsd">
    <titulo>Programación orientada a objetos con Java</titulo>
    <capitulo paginas="10" >
        <titulo_capitulo>Introducción XSD</titulo_capitulo>
        <contenido enlace="www.restricciones"/>
    </capitulo>
    <capitulo paginas="20">
        <titulo_capitulo>Restricciones XSD</titulo_capitulo>
        <contenido enlace="www.restricciones"/>
    </capitulo>
    <indice>Índice</indice>
    <sinopsis>Este libro es una introducción a XSD para desarrolladores principiantes.</sinopsis>
</libro>
